Title,Company,Location,Created,Description
Walkin For SAP MDM on 12th June 26 @Bangalore,Infosys BPM,"Mysore, Karnataka",2026-06-04T16:48:36Z,"Exclusive Walkin Drive for SAP MDM at Bangalore-Phase 2 on 12th June 26 Greeting from Infosys BPM Ltd., You are kindly invited for the Infosys BPM: Walk-In Drive on 12th June 26 Note: Please carry copy of this email to the venue and make sure you register your application before attending the walk-in. Please mention Candidate ID on top of the Resume Interview Information: Interview Date: 12th June 26 Interview Time: 10 AM till 1 PM Interview Venue - Bangalore Phase-2 Infosys Limited, No. 40/P-4…"
Data Engineer,IntraEdge,India,2026-06-05T17:19:41Z,"We are seeking a highly skilled Data Engineer with strong experience in Python, PySpark, Snowflake, and AWS Glue to join our growing data team. You will be responsible for building scalable and reliable data pipelines that drive business insights and operational efficiency. This role requires a deep understanding of data modelling, ETL frameworks, and cloud-based data platforms. Responsibilities: Design, develop, and maintain scalable ETL/ELT pipelines using PySpark and AWS Glue. Build and opti…"
Snowflake DBT,LTM,India,2026-06-06T07:41:56Z,Skills : DBT -Snowflake Experience : 3-12 yrs Location : Bhubaneswar Job Description: Key Responsibilities Design build and maintain scalable data pipelines using DBT and Snowflake Develop and optimize data models to support analytics reporting and business intelligence needs Collaborate with data analysts scientists and business stakeholders to ensure data availability and reliability Implement best practices for data governance security and compliance Monitor and troubleshoot data workflows t…
Lead Data Engineer,EXL,India,2026-06-05T17:18:54Z,"Role - Lead Data Engineer (AWS Lakehouse & Snowflake) Job Summary: We are seeking a highly experienced Lead Data Engineer with 9 years of expertise in designing and building scalable data platforms. The ideal candidate specializes in architecting modern data lake/lakehouse solutions on AWS, leveraging technologies such as S3, Apache Iceberg, PySpark, and Airflow, with Snowflake serving as the business intelligence and analytics layer. This role requires strong technical leadership, hands-on eng…"
IT Resume Specialist,ExcelEdge Placements,"Ahmedabad, Gujarat",2026-06-10T18:03:40Z,"We're Hiring – IT Resume Specialist Location: Gota, Ahmedabad (Onsite) Shift: US Shift (7:30 PM – 4:30 AM IST) Working Days: Monday to Friday Experience: 1 Years (Freshers with exceptional writing skills can also apply) About the Role We are looking for a skilled IT Resume Specialist who can create, optimize, and customize professional resumes for candidates across multiple IT domains. The ideal candidate should understand various technology roles and present candidate experience effectively ac…"
Data Engineer - Databricks,Tata Consultancy Services,"Hyderabad, Telangana",2026-06-02T16:38:12Z,"Greetings from TCS TCS is hiring Data Engineer (Databricks with Azure) Location – Any Years of Experience – 4-15 years Job Description Role - Senior Data Engineer – Databricks Required Technical Skill Set Databricks, PySpark, Delta Lake, MLflow, Azure, Data Lakehouse architecture, CI/CD, DataOps Job description- • Data Pipeline Development: Design, build, and optimize scalable data pipelines using Azure Data Factory, Azure Databricks, and other Azure services for data ingestion and processing. …"
Procurement Analyst,Nouryon,"Navi Mumbai, Maharashtra",2026-05-30T08:26:47Z,"At Nouryon, our global team takes positive action every day, to reach higher goals collectively and individually. We create innovative and sustainable solutions for our customers to answer society’s needs – today and in the future. Purpose of the Job We are seeking a skilled Procurement Data Analyst with a robust background in data analytics and a proven track record in consulting firms. The ideal candidate will have a strong background in procurement data analysis, particularly within the chem…"
Data Architect,WhiteLotus Talent Partners,"Bangalore, Karnataka",2026-06-07T07:43:20Z,"Job Title- Data Architect Location- Bangalore, Pan India Mode- Onsite Job Type: Full-Time Overview We are looking for a highly capable Data Analyst / Data Modeler / Data Architect to support a major enterprise data transformation programme, the Data Integration Hub (DIH). This role sits within a high-performing Data Architecture & Engineering function and will play a key part in delivering clean, reconciled, and business-ready data into our analytical platforms. You will work at the heart of th…"
GCP Data Engineer,Impetus,"Chennai, Tamil Nadu",2026-05-20T11:25:20Z,"Job Description — GCP Data Engineer Role: GCP Data Engineer We are seeking a skilled and motivated GCP Data Engineer with strong expertise in Python, PySpark, Spark, SQL, and Google Cloud Platform (GCP) to design, build, and optimize scalable data pipelines and analytics solutions. The ideal candidate will work closely with data analysts, data scientists, and business stakeholders to deliver reliable and high-performance data platforms. Key Responsibilities Design, develop, and maintain scalabl…"
Python Trainer,Anudip Foundation,"Ahmedabad, Gujarat",2026-06-06T17:32:24Z,"Company name- Anudip Foundation For Social Welfare Website- www.anudip.org Location- Ahmedabad, Ghaziabad and Bhopal Responsibilities: ● Conduct live-in person/virtual classes to train learners on Adv. Excel, Power BI, Python and adv Python libraries such as Numpy,Matplotlib, Pandas,seaborn, SciPy, SQL-MySQL, Data Analysis,basic statistical knowledge. ● Facilitate and support learners progress/journey to deliver personalized blended learning experience and achieve desired skill outcome ● Evalua…"
Lead Data Scientist,Straive,India,2026-05-24T17:56:14Z,"Job Title: Data Scientist Job Type:-Permanent Years of Experience – 7 Years About Straive: Straive is a market leading Content and Data Technology company providing data services, subject matter expertise, & technology solutions to multiple domains. Data Analytics & Al Solutions, Data Al Powered Operations and Education & Learning form the core pillars of the company’s long-term vision. The company is a specialized solutions provider to business information providers in finance, insurance, lega…"
Data Engineer,mCaffeine,"Mumbai, Maharashtra",2026-06-13T10:51:57Z,"Company overview: PEP is a dynamic personal care company that proudly houses two innovative brands – mCaffeine & Hyphen . With a passion for creating high-performance, conscious, and consumer-loved products, we are redefining the way personal care is experienced. While mCaffeine is India’s first caffeinated personal care brand, loved for its energizing and playful approach, Hyphen is built on the philosophy of simplifying skincare through science-backed formulations. Together, our brands reflec…"
Data Engineer,IntraEdge,India,2026-06-13T10:50:24Z,"Location: Remote & Hybrid Experience: 5 Years Responsibilities: Design, develop, and maintain scalable ETL/ELT pipelines using PySpark and AWS Glue. Build and optimize data models in Snowflake to support reporting, analytics, and machine learning workloads. Automate data ingestion from various sources including APIs, databases, and third-party platforms. Esure high data quality and implement data validation and monitoring processes. Collaborate with data analysts, data scientists, and other eng…"
